{
  "schema_version": "1.0",
  "dataset_id": "phase0-synthetic",
  "version": "1",
  "languages": [
    "en",
    "hi-IN"
  ],
  "source_name": "project_generated",
  "source_url": null,
  "license": "project-authored synthetic data (no project redistribution license selected)",
  "license_verified": true,
  "redistribution_allowed": null,
  "external_root": null,
  "annotation_type": "mixed",
  "status": "ready",
  "provenance_notes": "Audio generated by scripts/generate_fixtures.py (fixtures_v1); references and mock prediction scripts are hand-authored JSON. Synthetic Gate A data: validates harness infrastructure and scorers, never recognition quality.",
  "items": [
    {
      "item_id": "two-speaker-en",
      "languages": [
        "en"
      ],
      "split": "synthetic-test",
      "status": "ready",
      "audio_path": "../fixtures/audio/synthetic/two-speaker-en.wav",
      "audio_sha256": "3fb16deeea0f274f5ad0a36240a103cabf32cfd43cffe837cce10bb044c6435c",
      "sample_rate_hz": 16000,
      "channels": 1,
      "duration_samples": 192000,
      "reference_text_path": "../fixtures/annotations/two-speaker-en.transcript.json",
      "reference_text_sha256": "0974d8b4578f730de9754a86dba13af5eb48e0caf3a882f92a7a9567e4c71c25",
      "speaker_segments_path": "../fixtures/annotations/two-speaker-en.speakers.json",
      "speaker_segments_sha256": "aee122884f2cfdcc29d113853b4a1f50083f9ee185eb193fb29796c57e759b22",
      "reference_sha256": "b96b55c0ec06a7b74438ce71fc3b9cef117d3323593738e79e020ecf17bb77e1",
      "fixture_script_path": "../fixtures/scripts/two-speaker-en.json",
      "fixture_script_sha256": "95f6872c600b368e31e70b2816782762be5b11dfd1e478ce41e16873f0aed718",
      "annotation_type": "mixed",
      "coverage": {
        "transcript": true,
        "speakers": true,
        "joint_words": false
      },
      "rights_notes": "Project-generated synthetic fixture (tones and silence, not speech); no third-party content. No project redistribution license has been selected yet. Purpose: 16 kHz mono PCM16 (conversion bypassed); WER/CER/DER/JER with known errors."
    },
    {
      "item_id": "two-speaker-hi",
      "languages": [
        "hi-IN"
      ],
      "split": "synthetic-test",
      "status": "ready",
      "audio_path": "../fixtures/audio/synthetic/two-speaker-hi.wav",
      "audio_sha256": "dbb8f0ee1a40a952eb6b1b14ce757add4091b8ce28e7a7a5bded8c6811bb560e",
      "sample_rate_hz": 48000,
      "channels": 2,
      "duration_samples": 384000,
      "reference_text_path": "../fixtures/annotations/two-speaker-hi.transcript.json",
      "reference_text_sha256": "8b6251e504d38f6f068faa980c633f85293e3a1adead1fc9fdcbbc6f66aac4b0",
      "speaker_segments_path": "../fixtures/annotations/two-speaker-hi.speakers.json",
      "speaker_segments_sha256": "ff83ac76ae77996ad2e1a7493d4e7ec2635d15bb2ae5a81af959a390b9e90f4b",
      "reference_sha256": "aac35544efe04c528fbf9f37caa8a02bdb0a74e77ab0e398c26f98e9c1402065",
      "fixture_script_path": "../fixtures/scripts/two-speaker-hi.json",
      "fixture_script_sha256": "b8192a6557acadb8f800ede47eb8d21aa86dfe6b2dfa45c52c2a96f78cf9b756",
      "annotation_type": "mixed",
      "coverage": {
        "transcript": true,
        "speakers": true,
        "joint_words": false
      },
      "rights_notes": "Project-generated synthetic fixture (tones and silence, not speech); no third-party content. No project redistribution license has been selected yet. Purpose: 48 kHz stereo PCM16: downmix + exact 3:1 SRC; Devanagari scoring; references at the source rate."
    },
    {
      "item_id": "endpoint-trim-en",
      "languages": [
        "en"
      ],
      "split": "synthetic-test",
      "status": "ready",
      "audio_path": "../fixtures/audio/synthetic/endpoint-trim-en.wav",
      "audio_sha256": "1ad16166c8b704e0633445e61454a6aad10b29b7387b76042b0b4fc3eeacb6f8",
      "sample_rate_hz": 22050,
      "channels": 1,
      "duration_samples": 22049,
      "reference_text_path": "../fixtures/annotations/endpoint-trim-en.transcript.json",
      "reference_text_sha256": "fb96520b768ba88b214016343a3c9905bfc96b52ad8c10372d4ee078d1fc711d",
      "speaker_segments_path": "../fixtures/annotations/endpoint-trim-en.speakers.json",
      "speaker_segments_sha256": "c47aa66776c65ba786bdc60807c90998b66f44128ce1ea26f29b3a4167e38ff1",
      "reference_sha256": "d0e30c57895e6115b3ba14c2fca1fa3582a2d9df5bfc5d7fa5d04332029be722",
      "fixture_script_path": "../fixtures/scripts/endpoint-trim-en.json",
      "fixture_script_sha256": "2b2d1bb201bb1c7801e625a50412f4029e9f17b104d051929c4395debfddafd6",
      "annotation_type": "mixed",
      "coverage": {
        "transcript": true,
        "speakers": true,
        "joint_words": false
      },
      "rights_notes": "Project-generated synthetic fixture (tones and silence, not speech); no third-party content. No project redistribution license has been selected yet. Purpose: 22,049 frames at 22.05 kHz: AVAudioConverter emits one extra frame, so allow_one_frame_v1 trims it (DEC-026 disclosure)."
    }
  ]
}
